{
  "$schema": "../../../schemas/extension.schema.json",
  "schemaVersion": 2,
  "protocolVersion": "0.2",
  "id": "hairness/delivery-controls",
  "version": "0.2.0-alpha.0",
  "summary": "Sequential delivery plans, Git checkpoints, receipts and release candidates.",
  "category": "forge",
  "tags": ["delivery", "release", "self-hosting"],
  "maturity": "experimental",
  "readme": "./README.md",
  "module": "./index.mjs",
  "capabilities": ["./capabilities/delivery.json"],
  "dependencies": ["hairness/initiative-controls", "hairness/work-controls"],
  "commands": [{ "namespace": "delivery", "actions": ["plan", "status", "checkpoint", "receipt", "release-candidate"] }],
  "artifactSchemas": [{ "type": "release-candidate", "schema": "./schemas/release-candidate.schema.json" }],
  "commandSurfaces": []
}
